{
  "version": 1,
  "lot_id": "a1b2c3d4-e5f6-4a7b-8c9d-0e1f2a3b4c5d",
  "ecran": "ecran_principal",
  "origine": "navigateur",
  "tache_id": 17,
  "commandes": [
    {
      "op": "selectionner",
      "cible": {
        "noeud": "lemme_compacite"
      }
    },
    {
      "op": "cadrer",
      "cibles": "selection"
    }
  ]
}
